{"run_id":"run-demo","provider":"acme-pay","repo":"patchbay-demo-python","status":"verifying","vm_id":"vm-2c8e55b0","sandbox":"freestyle","attempts":[
{"n":1,"model":"deepseek-v4.1-flash","tests":"fail","log_tail":"FAILED tests/test_cards.py::test_list_cards\nAttributeError: 'dict' object has no attribute 'cards'\n1 failed, 6 passed"}],
"pr_url":null,"started_at":"2026-10-17T15:00:00Z","finished_at":null}
