{"run_id":"run-openai","provider":"openai","repo":"hayobro7512/patchbay-demo-storefront","status":"verifying","vm_id":"vm-a93f20cc41e8","sandbox":"freestyle","attempts":[
{"n":1,"model":"deepseek-v4.1-flash","tests":"fail","log_tail":"FAIL tests/checkout.test.ts\n  Expected request body to include model\n  Received: {\"prompt\":\"poster\"}\nTests: 1 failed, 3 passed"}],
"pr_url":null,"started_at":"2026-10-17T15:00:30Z","finished_at":null}
